{"entries":[{"history_retained":true,"native_id":"AGENT_RULES.md","previous_revision":null,"previous_watermark":null,"revision":"7c8b927a6168bc7757b13d064efdbe41c03a0e10","scenario":"current","tombstone":false,"watermark":"1786341832836628064"},{"history_retained":true,"native_id":"INDEX.md","previous_revision":"7c8b927a6168bc7757b13d064efdbe41c03a0e19","previous_watermark":"1786341832836628060","revision":"7c8b927a6168bc7757b13d064efdbe41c03a0e11","scenario":"updated","tombstone":false,"watermark":"1786341832836628065"},{"history_retained":true,"native_id":"ops/repo-cleanup.md","previous_revision":"7c8b927a6168bc7757b13d064efdbe41c03a0e12","previous_watermark":"1786341832836628061","revision":null,"scenario":"deleted_tombstone","tombstone":true,"watermark":"1786341832836628066"},{"history_retained":false,"native_id":"voice/_template.md","previous_revision":null,"previous_watermark":null,"revision":"7c8b927a6168bc7757b13d064efdbe41c03a0e13","scenario":"history_unavailable_before_floor","tombstone":false,"watermark":"1786341832836628067"}],"fixture_digest":"75078444c9ab73896c862302da956cabe2b987f4d1d7e5011d2de1fa2e8306d6","fixture_version":"second-brain-me-wiki-mapping-fixture-v1","row_set_digest":"8ced64851da97972e1daf5715a3adcb9ebd59403f5920ff292611dbb63db58f4","source_name":"me-wiki"}
